{
  "contract_version": 1,
  "location": {
    "origin": "http://localhost:4000",
    "path": "/cards",
    "query_names": [
      "page"
    ]
  },
  "route": null,
  "snapshot": {
    "tag": "main",
    "name": "Cards",
    "children": [
      {
        "tag": "h1",
        "text": "Cards",
        "children": []
      }
    ]
  },
  "focus_points": [
    {
      "selector": "[data-testid=\"card-1\"]",
      "source_status": "unavailable",
      "ancestors": [
        {
          "tag": "main",
          "name": "Cards"
        }
      ],
      "subtree": {
        "tag": "article",
        "name": "Card 1",
        "attributes": {
          "data-testid": "card-1"
        },
        "children": [
          {
            "tag": "button",
            "text": "Open",
            "children": []
          }
        ]
      }
    },
    {
      "selector": "[data-testid=\"card-1\"]",
      "source_status": "unavailable",
      "ancestors": [
        {
          "tag": "main",
          "name": "Cards"
        }
      ],
      "subtree": {
        "tag": "article",
        "name": "Card 1",
        "attributes": {
          "data-testid": "card-1"
        },
        "children": [
          {
            "tag": "button",
            "text": "Open",
            "children": []
          }
        ]
      }
    }
  ],
  "truncation": []
}
